<?xml version="1.0" encoding="utf-8"?>
<!-- Copyright (C) 2010 The Android Open Source Project

     Licensed under the Apache License, Version 2.0 (the "License");
     you may not use this file except in compliance with the License.
     You may obtain a copy of the License at

          http://www.apache.org/licenses/LICENSE-2.0

     Unless required by applicable law or agreed to in writing, software
     distributed under the License is distributed on an "AS IS" BASIS,
     WITHOUT WARRANTIES OR CONDITIONS OF ANY KIND, either express or implied.
     See the License for the specific language governing permissions and
     limitations under the License.
-->
<!DOCTYPE MediaSettings [
<!ELEMENT MediaSettings (CamcorderProfiles,
                         EncoderOutputFileFormat+,
                         VideoEncoderCap+,
                         AudioEncoderCap+,
                         VideoDecoderCap,
                         AudioDecoderCap)>
<!ELEMENT CamcorderProfiles (EncoderProfile+, ImageEncoding+, ImageDecoding, Camera)>
<!ELEMENT EncoderProfile (Video, Audio)>
<!ATTLIST EncoderProfile quality (high|low|480p|cif|qcif) #REQUIRED>
<!ATTLIST EncoderProfile fileFormat (mp4|3gp) #REQUIRED>
<!ATTLIST EncoderProfile duration (30|60) #REQUIRED>
<!ATTLIST EncoderProfile cameraId (0|1) #REQUIRED>
<!ELEMENT Video EMPTY>
<!ATTLIST Video codec (h264|h263|m4v) #REQUIRED>
<!ATTLIST Video bitRate CDATA #REQUIRED>
<!ATTLIST Video width CDATA #REQUIRED>
<!ATTLIST Video height CDATA #REQUIRED>
<!ATTLIST Video frameRate CDATA #REQUIRED>
<!ELEMENT Audio EMPTY>
<!ATTLIST Audio codec (amrnb|amrwb|aac) #REQUIRED>
<!ATTLIST Audio bitRate CDATA #REQUIRED>
<!ATTLIST Audio sampleRate CDATA #REQUIRED>
<!ATTLIST Audio channels (1|2) #REQUIRED>
<!ELEMENT ImageEncoding EMPTY>
<!ATTLIST ImageEncoding quality (90|80|70|60|50|40) #REQUIRED>
<!ELEMENT ImageDecoding EMPTY>
<!ATTLIST ImageDecoding memCap CDATA #REQUIRED>
<!ELEMENT Camera EMPTY>
<!ELEMENT EncoderOutputFileFormat EMPTY>
<!ATTLIST EncoderOutputFileFormat name (mp4|3gp) #REQUIRED>
<!ELEMENT VideoEncoderCap EMPTY>
<!ATTLIST VideoEncoderCap name (h264|h263|m4v|wmv) #REQUIRED>
<!ATTLIST VideoEncoderCap enabled (true|false) #REQUIRED>
<!ATTLIST VideoEncoderCap minBitRate CDATA #REQUIRED>
<!ATTLIST VideoEncoderCap maxBitRate CDATA #REQUIRED>
<!ATTLIST VideoEncoderCap minFrameWidth CDATA #REQUIRED>
<!ATTLIST VideoEncoderCap maxFrameWidth CDATA #REQUIRED>
<!ATTLIST VideoEncoderCap minFrameHeight CDATA #REQUIRED>
<!ATTLIST VideoEncoderCap maxFrameHeight CDATA #REQUIRED>
<!ATTLIST VideoEncoderCap minFrameRate CDATA #REQUIRED>
<!ATTLIST VideoEncoderCap maxFrameRate CDATA #REQUIRED>
<!ELEMENT AudioEncoderCap EMPTY>
<!ATTLIST AudioEncoderCap name (amrnb|amrwb|aac|wma) #REQUIRED>
<!ATTLIST AudioEncoderCap enabled (true|false) #REQUIRED>
<!ATTLIST AudioEncoderCap minBitRate CDATA #REQUIRED>
<!ATTLIST AudioEncoderCap maxBitRate CDATA #REQUIRED>
<!ATTLIST AudioEncoderCap minSampleRate CDATA #REQUIRED>
<!ATTLIST AudioEncoderCap maxSampleRate CDATA #REQUIRED>
<!ATTLIST AudioEncoderCap minChannels (1|2) #REQUIRED>
<!ATTLIST AudioEncoderCap maxChannels (1|2) #REQUIRED>
<!ELEMENT VideoDecoderCap EMPTY>
<!ATTLIST VideoDecoderCap name (wmv) #REQUIRED>
<!ATTLIST VideoDecoderCap enabled (true|false) #REQUIRED>
<!ELEMENT AudioDecoderCap EMPTY>
<!ATTLIST AudioDecoderCap name (wma) #REQUIRED>
<!ATTLIST AudioDecoderCap enabled (true|false) #REQUIRED>
<!ELEMENT VideoEditorCap EMPTY>
<!ATTLIST VideoEditorCap maxInputFrameWidth CDATA #REQUIRED>
<!ATTLIST VideoEditorCap maxInputFrameHeight CDATA #REQUIRED>
<!ATTLIST VideoEditorCap maxOutputFrameWidth CDATA #REQUIRED>
<!ATTLIST VideoEditorCap maxOutputFrameHeight CDATA #REQUIRED>
<!ATTLIST VideoEditorCap maxPrefetchYUVFrames CDATA #REQUIRED>
<!ELEMENT ExportVideoProfile EMPTY>
<!ATTLIST ExportVideoProfile name (h264|h263|m4v) #REQUIRED>
<!ATTLIST ExportVideoProfile profile CDATA #REQUIRED>
<!ATTLIST ExportVideoProfile level CDATA #REQUIRED>
]>
<!--
     This file is used to declare the multimedia profiles and capabilities
     on an android-powered device.
-->
<MediaSettings>
<CamcorderProfiles cameraId="0">

<VideoDecoderCap name="wmv" enabled="true" />
<AudioDecoderCap name="wma" enabled="true" />

<AudioEncoderCap name="amrwb"
enabled="true"
minBitRate="6600"
maxBitRate="23050"
minSampleRate="16000"
maxSampleRate="16000"
minChannels="1"
maxChannels="1" />

<AudioEncoderCap name="amrnb"
enabled="true"
minBitRate="2600"
maxBitRate="4200"
minSampleRate="8000"
maxSampleRate="8000"
minChannels="1"
maxChannels="1" />

<VideoEncoderCap name="h263"
enabled="true"
minBitRate="192000"
maxBitRate="420000"
minFrameWidth="176"
maxFrameWidth="352"
minFrameHeight="144"
maxFrameHeight="288"
minFrameRate="1"
maxFrameRate="20" />

<VideoEncoderCap name="m4v"
enabled="true"
minBitRate="192000"
maxBitRate="1440000"
minFrameWidth="176"
maxFrameWidth="640"
minFrameHeight="144"
maxFrameHeight="480"
minFrameRate="1"
maxFrameRate="15" />

<EncoderProfile quality="low" fileFormat="3gp" duration="30">
<Video codec="m4v"
bitRate="1440000"
width="176"
height="144"
frameRate="15" />

<Audio codec="amrwb"
bitRate="23050"
sampleRate="16000"
channels="1" />
</EncoderProfile>

<EncoderProfile quality="timelapselow" fileFormat="3gp" duration="30">
<Video codec="m4v"
bitRate="1440000"
width="176"
height="144"
frameRate="15" />

<Audio codec="amrwb"
bitRate="23050"
sampleRate="16000"
channels="1" />
</EncoderProfile>

<EncoderProfile quality="high" fileFormat="3gp" duration="60">
<Video codec="m4v"
bitRate="1440000"
width="640"
height="480"
frameRate="15" />

<Audio codec="amrwb"
bitRate="23050"
sampleRate="16000"
channels="1" />
</EncoderProfile>

<EncoderProfile quality="timelapsehigh" fileFormat="3gp" duration="60">
<Video codec="m4v"
bitRate="1440000"
width="640"
height="480"
frameRate="15" />

<Audio codec="amrwb"
bitRate="23050"
sampleRate="16000"
channels="1" />
</EncoderProfile>

<EncoderProfile quality="480p" fileFormat="3gp" duration="60">
<Video codec="m4v"
bitRate="1440000"
width="640"
height="480"
frameRate="15" />

<Audio codec="amrwb"
bitRate="23050"
sampleRate="16000"
channels="1" />
</EncoderProfile>

<EncoderProfile quality="timelapse480p" fileFormat="3gp" duration="60">
<Video codec="m4v"
bitRate="1440000"
width="640"
height="480"
frameRate="15" />

<Audio codec="amrwb"
bitRate="23050"
sampleRate="16000"
channels="1" />
</EncoderProfile>

<EncoderProfile quality="cif" fileFormat="3gp" duration="30">
<Video codec="m4v"
bitRate="1440000"
width="352"
height="288"
frameRate="15" />

<Audio codec="amrwb"
bitRate="23050"
sampleRate="16000"
channels="1" />
</EncoderProfile>

<EncoderProfile quality="timelapsecif" fileFormat="3gp" duration="30">
<Video codec="m4v"
bitRate="1440000"
width="352"
height="288"
frameRate="15" />

<Audio codec="amrwb"
bitRate="23050"
sampleRate="16000"
channels="1" />
</EncoderProfile>

<EncoderProfile quality="qcif" fileFormat="3gp" duration="30">
<Video codec="m4v"
bitRate="1440000"
width="176"
height="144"
frameRate="15" />

<Audio codec="amrwb"
bitRate="23050"
sampleRate="16000"
channels="1" />
</EncoderProfile>

<EncoderProfile quality="timelapseqcif" fileFormat="3gp" duration="30">
<Video codec="m4v"
bitRate="1440000"
width="176"
height="144"
frameRate="15" />

<Audio codec="amrwb"
bitRate="23050"
sampleRate="16000"
channels="1" />
</EncoderProfile>

<EncoderOutputFileFormat name="3gp" />
<EncoderOutputFileFormat name="mp4" />

<ImageEncoding quality="70" />
<ImageEncoding quality="80" />
<ImageEncoding quality="90" />

</CamcorderProfiles>


<CamcorderProfiles cameraId="1">

<VideoDecoderCap name="wmv" enabled="true" />
<AudioDecoderCap name="wma" enabled="true" />

<AudioEncoderCap name="amrwb"
enabled="true"
minBitRate="6600"
maxBitRate="23050"
minSampleRate="16000"
maxSampleRate="16000"
minChannels="1"
maxChannels="1" />

<AudioEncoderCap name="amrnb"
enabled="true"
minBitRate="2600"
maxBitRate="4200"
minSampleRate="8000"
maxSampleRate="8000"
minChannels="1"
maxChannels="1" />

<VideoEncoderCap name="h263"
enabled="true"
minBitRate="192000"
maxBitRate="420000"
minFrameWidth="176"
maxFrameWidth="352"
minFrameHeight="144"
maxFrameHeight="288"
minFrameRate="1"
maxFrameRate="20" />

<VideoEncoderCap name="m4v"
enabled="true"
minBitRate="192000"
maxBitRate="1440000"
minFrameWidth="176"
maxFrameWidth="640"
minFrameHeight="144"
maxFrameHeight="480"
minFrameRate="1"
maxFrameRate="15" />

<EncoderProfile quality="low" fileFormat="3gp" duration="30">
<Video codec="m4v"
bitRate="1440000"
width="176"
height="144"
frameRate="15" />

<Audio codec="amrwb"
bitRate="23050"
sampleRate="16000"
channels="1" />
</EncoderProfile>

<EncoderProfile quality="timelapselow" fileFormat="3gp" duration="30">
<Video codec="m4v"
bitRate="1440000"
width="176"
height="144"
frameRate="15" />

<Audio codec="amrwb"
bitRate="23050"
sampleRate="16000"
channels="1" />
</EncoderProfile>

<EncoderProfile quality="high" fileFormat="3gp" duration="60">
<Video codec="m4v"
bitRate="1440000"
width="640"
height="480"
frameRate="15" />

<Audio codec="amrwb"
bitRate="23050"
sampleRate="16000"
channels="1" />
</EncoderProfile>

<EncoderProfile quality="timelapsehigh" fileFormat="3gp" duration="60">
<Video codec="m4v"
bitRate="1440000"
width="640"
height="480"
frameRate="15" />

<Audio codec="amrwb"
bitRate="23050"
sampleRate="16000"
channels="1" />
</EncoderProfile>

<EncoderProfile quality="480p" fileFormat="3gp" duration="60">
<Video codec="m4v"
bitRate="1440000"
width="640"
height="480"
frameRate="15" />

<Audio codec="amrwb"
bitRate="23050"
sampleRate="16000"
channels="1" />
</EncoderProfile>

<EncoderProfile quality="timelapse480p" fileFormat="3gp" duration="60">
<Video codec="m4v"
bitRate="1440000"
width="640"
height="480"
frameRate="15" />

<Audio codec="amrwb"
bitRate="23050"
sampleRate="16000"
channels="1" />
</EncoderProfile>

<EncoderProfile quality="cif" fileFormat="3gp" duration="30">
<Video codec="m4v"
bitRate="1440000"
width="352"
height="288"
frameRate="15" />

<Audio codec="amrwb"
bitRate="23050"
sampleRate="16000"
channels="1" />
</EncoderProfile>

<EncoderProfile quality="timelapsecif" fileFormat="3gp" duration="30">
<Video codec="m4v"
bitRate="1440000"
width="352"
height="288"
frameRate="15" />

<Audio codec="amrwb"
bitRate="23050"
sampleRate="16000"
channels="1" />
</EncoderProfile>

<EncoderProfile quality="qcif" fileFormat="3gp" duration="30">
<Video codec="m4v"
bitRate="1440000"
width="176"
height="144"
frameRate="15" />

<Audio codec="amrwb"
bitRate="23050"
sampleRate="16000"
channels="1" />
</EncoderProfile>

<EncoderProfile quality="timelapseqcif" fileFormat="3gp" duration="30">
<Video codec="m4v"
bitRate="1440000"
width="176"
height="144"
frameRate="15" />

<Audio codec="amrwb"
bitRate="23050"
sampleRate="16000"
channels="1" />
</EncoderProfile>

<EncoderOutputFileFormat name="3gp" />
<EncoderOutputFileFormat name="mp4" />

<ImageEncoding quality="70" />
<ImageEncoding quality="80" />
<ImageEncoding quality="90" />

</CamcorderProfiles>
</MediaSettings>
